### ISSUE TITLE
wss:// silently sends the WebSocket handshake in cleartext on any non-OpenSSL build

### ISSUE THREAD

**Issue by Buksa** [Buksa/movian#213]
Found while verifying `plugin_examples` on the stand. `plugin_examples/03-advanced/01-websocket-client` never connects — and the reason is not the example.

## What goes on the wire

A probe plugin that opens `wss://echo.websocket.org/` on route entry, captured with `tcpdump` on the stand:

```
19:35:23 192.168.1.82.59370 > 66.241.124.119.443: Flags [S]        # SYN
19:35:23 66.241.124.119.443 > 192.168.1.82.59370: Flags [S.]       # SYN-ACK
19:35:23 192.168.1.82.59370 > 66.241.124.119.443: Flags [P.], length 157
        0x0030:  ...  GET / HTTP/1.1
        0x0040:  Host: echo.websocket.org
        0x0060:  Connection: Upgrade
        0x0070:  Upgrade: websocket
        0x0090:  Sec-WebSocket-Version: 13
        0x00b0:  Sec-WebSocket-Key: C4SxA5OgynJ2rNuQZHap+Q==
19:35:23 66.241.124.119.443 > 192.168.1.82.59370: Flags [R.]       # RST
```

**That is cleartext HTTP on port 443.** No TLS record, no ClientHello. For contrast, Movian's own `http.request()` to the *same host in the same process* sends a proper handshake and succeeds:

```
19:37:19 ... length 411
        0x0030:  1603 0101 9601 0001 9203 03..     # TLS handshake, ClientHello
        ... 1168 bytes of response, statuscode 200
```

## Why

Every link verified, none inferred:

1. `support/configure-linux-debug.sh` builds with `--enable-polarssl`; this build has `CONFIG_POLARSSL=yes` and **no OpenSSL** — `nm` finds zero `SSL_CTX_new` symbols in the binary.
2. `src/networking/asyncio_posix.c:1829` is therefore the live definition:
   ```c
   void *asyncio_ssl_create_client(void) { return NULL; }   // #else branch
   ```
3. `src/ecmascript/es_websocket.c:591-593` calls it for the `wss` scheme and **never checks the result**:
   ```c
   if(!strcmp(protostr, "wss"))
     ewc->ewc_tlsctx = asyncio_ssl_create_client();
   ```
4. `es_websocket.c:540-546` passes that NULL to `asyncio_connect`, which then connects without TLS — to port 443, because step 3's sibling branch already set the port from the scheme.
5. `onclose` fires. **Nothing is logged at any point** between "connecting" and the close.

## Why this is more than a broken feature

The failure is silent and it is in the unsafe direction. A caller writes `wss://`, the port says 443, and the `Sec-WebSocket-Key` goes out unencrypted. This server answers `RST`; a server that *accepts* cleartext on 443, or any middlebox, gets the whole session in the clear with nothing in the log to say so.

The asymmetry is the tell: **TLS exists in this binary** — PolarSSL, which `http.request()` uses successfully — it is simply not wired into the asyncio path that the websocket client uses.

## Reproduces on three independent endpoints

`wss://echo.websocket.org/`, `wss://echo.websocket.events/`, `wss://ws.postman-echo.com/raw` — all `CLOSE`, no `OPEN`. Plain `ws://` fails as well, so this is not only the TLS half; but the cleartext-on-443 behaviour is the security-relevant part.

## Suggested shape of a fix

At minimum, `wss` must fail loudly when no TLS client context can be created, rather than degrade to cleartext — a `duk_error` at `es_websocket.c:592` when the context is NULL would already close the security hole. Actually supporting `wss` on PolarSSL builds is the larger piece and is a separate decision.

## Not verified here

Whether an OpenSSL-enabled build connects. This stand builds PolarSSL, which is what `support/configure-linux-debug.sh` selects, so it is the configuration developers get by default.
